<?xml version="1.0" encoding="UTF-8"?>

<xs:schema xmlns:xs="http://www.w3.org/2001/XMLSchema"
	targetNamespace="http://www.pkck.com" xmlns:tns="http://www.pkck.com"
	elementFormDefault="qualified" attributeFormDefault="unqualified">

	<xs:simpleType name="typWersja">
		<xs:restriction base="xs:decimal">
			<xs:fractionDigits value="1" />
		</xs:restriction>
	</xs:simpleType>

	<xs:complexType name="typAutor">
		<xs:sequence>
			<xs:element name="imię_autora" type="tns:typImię" minOccurs="1"
				maxOccurs="2" />
			<xs:element name="nazwisko_autora" type="xs:string" />
			<xs:element name="nr_indeksu" type="tns:typIndeks" />
		</xs:sequence>
	</xs:complexType>

	<xs:simpleType name="typImię">
		<xs:restriction base="xs:string">
			<xs:maxLength value="20" />
		</xs:restriction>
	</xs:simpleType>

	<xs:simpleType name="typIndeks">
		<xs:restriction base="xs:unsignedInt">
			<xs:pattern value="[1-9][0-9]{5}" />
		</xs:restriction>
	</xs:simpleType>

	<xs:complexType name="typKlient">
		<xs:sequence>
			<xs:element name="imię_klienta" type="xs:string"
				minOccurs="1" maxOccurs="2" />
			<xs:element name="nazwisko_klienta" type="xs:string" />
			<xs:element name="telefon" type="tns:typTelefon" />
		</xs:sequence>
	</xs:complexType>

	<xs:simpleType name="typCena">
		<xs:restriction base="xs:decimal">
			<xs:fractionDigits value="2" />
		</xs:restriction>
	</xs:simpleType>

	<xs:simpleType name="typWaluta">
		<xs:restriction base="xs:string">
			<xs:enumeration value="PLN" />
			<xs:enumeration value="EUR" />
			<xs:enumeration value="USD" />
		</xs:restriction>
	</xs:simpleType>

	<xs:attributeGroup name="towarAtrybuty">
		<xs:attribute name="nazwa_towaru" type="xs:string" use="required" />
		<xs:attribute name="dział" type="xs:string" />
	</xs:attributeGroup>

	<xs:simpleType name="typTelefon">
		<xs:restriction base="xs:unsignedInt">
			<xs:pattern value="[1-9][0-9]{8}" />
		</xs:restriction>
	</xs:simpleType>

	<xs:complexType name="typPłatność">
		<xs:attributeGroup ref="tns:typPłatnośćAtrybuty" />
	</xs:complexType>

	<xs:attributeGroup name="zamówienieAtrybuty">
		<xs:attribute name="id_zamówienia" type="xs:integer" use="required" />
		<xs:attribute name="towar" type="xs:string" />
	</xs:attributeGroup>

	<xs:attributeGroup name="typPłatnośćAtrybuty">
		<xs:attribute name="kanał" type="tns:typKanał" default="przelew" />
		<xs:attribute name="raty" type="tns:typRaty" default="nie" />
	</xs:attributeGroup>

	<xs:simpleType name="typKanał">
		<xs:restriction base="xs:string">
			<xs:enumeration value="przelew" />
			<xs:enumeration value="gotówka" />
			<xs:enumeration value="karta" />
		</xs:restriction>
	</xs:simpleType>

	<xs:simpleType name="typRaty">
		<xs:restriction base="xs:NMTOKEN">
			<xs:enumeration value="tak" />
			<xs:enumeration value="nie" />
		</xs:restriction>
	</xs:simpleType>

	<xs:element name="hurtownia">
		<xs:complexType>
			<xs:sequence>
				<xs:element name="autorzy">
					<xs:complexType>
						<xs:sequence>
							<xs:element name="autor" type="tns:typAutor" minOccurs="0"
								maxOccurs="unbounded" />
						</xs:sequence>
					</xs:complexType>
				</xs:element>
				<xs:element name="działy">
					<xs:complexType>
						<xs:sequence>
							<xs:element name="dział" minOccurs="0" maxOccurs="unbounded">
								<xs:complexType>
									<xs:sequence>
										<xs:element name="opis_działu" type="xs:string"
											minOccurs="0" maxOccurs="1" />
									</xs:sequence>
									<xs:attribute name="nazwa_działu" type="xs:string"
										use="required" />
								</xs:complexType>

							</xs:element>
						</xs:sequence>
					</xs:complexType>
				</xs:element>
				<xs:element name="towary">
					<xs:complexType>
						<xs:sequence>
							<xs:element name="towar" minOccurs="0" maxOccurs="unbounded">
								<xs:complexType>
									<xs:sequence>
										<xs:element name="cena">
											<xs:complexType>
												<xs:simpleContent>
													<xs:extension base="tns:typCena">
														<xs:attribute name="waluta" type="tns:typWaluta"
															default="PLN" />
													</xs:extension>
												</xs:simpleContent>
											</xs:complexType>
										</xs:element>
										<xs:element name="opis_towaru" type="xs:string"
											minOccurs="0" maxOccurs="1" />
									</xs:sequence>

									<xs:attributeGroup ref="tns:towarAtrybuty" />
								</xs:complexType>

							</xs:element>
						</xs:sequence>
					</xs:complexType>
				</xs:element>
				<xs:element name="zamówienia">
					<xs:complexType>
						<xs:sequence>
							<xs:element name="zamówienie" minOccurs="0" maxOccurs="unbounded">
								<xs:complexType>
									<xs:sequence>
										<xs:element name="klient" type="tns:typKlient" />
										<xs:element name="liczba_sztuk" type="xs:integer"/>
										<xs:element name="data_złożenia" type="xs:date" />
										<xs:element name="płatność" type="tns:typPłatność" />
									</xs:sequence>
									<xs:attributeGroup ref="tns:zamówienieAtrybuty" />
								</xs:complexType>
							</xs:element>
						</xs:sequence>
					</xs:complexType>
				</xs:element>
			</xs:sequence>
			<xs:attribute name="wersja" type="tns:typWersja" fixed="1.0" />
		</xs:complexType>
		
		<xs:keyref refer="tns:towar_key" name="zamówienieKeyRef">
			<xs:selector xpath="tns:zamówienia/tns:zamówienie" />
			<xs:field xpath="@towar" />
		</xs:keyref>
		
		<xs:key name="zamówienie_key">
			<xs:selector xpath="tns:zamówienia/tns:zamówienie" />
			<xs:field xpath="@id_zamówienia" />
		</xs:key>
		
		<xs:key name="dział_key">
			<xs:selector xpath="tns:działy/tns:dział" />
			<xs:field xpath="@nazwa_działu" />
		</xs:key>
		
		<xs:key name="towar_key">
			<xs:selector xpath="tns:towary/tns:towar" />
			<xs:field xpath="@nazwa_towaru" />
		</xs:key>
		
		<xs:keyref refer="tns:dział_key" name="działKeyRef">
			<xs:selector xpath="tns:towary/tns:towar"></xs:selector>
			<xs:field xpath="@dział"></xs:field>
		</xs:keyref>
	</xs:element>
</xs:schema>