<?xml version="1.0" encoding="UTF-8"?>
<pkck:hurtownia wersja="1.0" 
 xmlns:xsi="http://www.w3.org/2001/XMLSchema-instance"
 xmlns:pkck="http://www.pkck.com"
 xsi:schemaLocation="http://www.pkck.com hurtownia.xsd">

	 <pkck:autorzy>
		<pkck:autor>
			<pkck:imię_autora>Przemysław</pkck:imię_autora>
			<pkck:nazwisko_autora>Holak</pkck:nazwisko_autora>
			<pkck:nr_indeksu>180557</pkck:nr_indeksu>
		</pkck:autor>
		<pkck:autor>
			<pkck:imię_autora>Bartłomiej</pkck:imię_autora>
			<pkck:nazwisko_autora>Długosz</pkck:nazwisko_autora>
			<pkck:nr_indeksu>180525</pkck:nr_indeksu>
		</pkck:autor>
	</pkck:autorzy>

	<pkck:działy>
		<pkck:dział nazwa_działu="Elektronika">
			<pkck:opis_działu>Elementy elektroniczne</pkck:opis_działu>
		</pkck:dział>
		<pkck:dział nazwa_działu="Telefony">
			<pkck:opis_działu>Telefony komórkowe</pkck:opis_działu>
		</pkck:dział>
		<pkck:dział nazwa_działu="Biuro">
			<pkck:opis_działu>Papier etc.</pkck:opis_działu>
		</pkck:dział>
	</pkck:działy>
	
	
	<pkck:towary>
		<pkck:towar nazwa_towaru="Telefon1" dział="Elektronika">
			<pkck:cena>500.00</pkck:cena>
			<pkck:opis_towaru>Dobry telefon</pkck:opis_towaru>
		</pkck:towar>
		<pkck:towar nazwa_towaru="Telefon2" dział="Telefony">
			<pkck:cena>399.99</pkck:cena>
			<pkck:opis_towaru>Gorszy telefon</pkck:opis_towaru>
		</pkck:towar>
		<pkck:towar nazwa_towaru="GPS" dział="Elektronika">
			<pkck:cena>699.99</pkck:cena>
			<pkck:opis_towaru>Dobra nawigacja</pkck:opis_towaru>
		</pkck:towar>
		<pkck:towar nazwa_towaru="Tablet" dział="Elektronika">
			<pkck:cena>199.99</pkck:cena>
			<pkck:opis_towaru>Tani tablet</pkck:opis_towaru>
		</pkck:towar>
		<pkck:towar nazwa_towaru="Papier" dział="Biuro">
			<pkck:cena>15.99</pkck:cena>
			<pkck:opis_towaru>Najlepszy papier</pkck:opis_towaru>
		</pkck:towar>
		<pkck:towar nazwa_towaru="Spinacz" dział="Biuro">
			<pkck:cena waluta="USD">2.00</pkck:cena>
			<pkck:opis_towaru>Elegancki spinacz</pkck:opis_towaru>
		</pkck:towar>
	</pkck:towary>
	
	<pkck:zamówienia>
		<pkck:zamówienie id_zamówienia="ddd1" towar="GPS">
			<pkck:klient>
				<pkck:imię_klienta>Marcin</pkck:imię_klienta>
				<pkck:nazwisko_klienta>Trawka</pkck:nazwisko_klienta>
				<pkck:telefon>333333333</pkck:telefon>
			</pkck:klient>
			<pkck:liczba_sztuk>1</pkck:liczba_sztuk>
			<pkck:data_złożenia>2002-09-24</pkck:data_złożenia>
			<pkck:płatność kanał="gotówka" raty="nie"/>
		</pkck:zamówienie>
		<pkck:zamówienie id_zamówienia="2" towar="Tablet">
			<pkck:klient>
				<pkck:imię_klienta>Adam</pkck:imię_klienta>
				<pkck:nazwisko_klienta>Sprawka</pkck:nazwisko_klienta>
				<pkck:telefon>222222222</pkck:telefon>
			</pkck:klient>
			<pkck:liczba_sztuk>1</pkck:liczba_sztuk>
			<pkck:data_złożenia>2002-09-24</pkck:data_złożenia>
			<pkck:płatność kanał="przelew" raty="tak"/>
		</pkck:zamówienie>
		<pkck:zamówienie id_zamówienia="3" towar="Tablet">
			<pkck:klient>
				<pkck:imię_klienta>Przemysław</pkck:imię_klienta>
				<pkck:nazwisko_klienta>Długi</pkck:nazwisko_klienta>
				<pkck:telefon>999999999</pkck:telefon>
			</pkck:klient>
			<pkck:liczba_sztuk>2</pkck:liczba_sztuk>
			<pkck:data_złożenia>2002-09-24</pkck:data_złożenia>
			<pkck:płatność kanał="gotówka" raty="nie"/>
		</pkck:zamówienie>
		<pkck:zamówienie id_zamówienia="4" towar="Spinacz">
			<pkck:klient>
				<pkck:imię_klienta>Marian</pkck:imię_klienta>
				<pkck:nazwisko_klienta>Wojciechowski</pkck:nazwisko_klienta>
				<pkck:telefon>111111111</pkck:telefon>
			</pkck:klient>
			<pkck:liczba_sztuk>100</pkck:liczba_sztuk>
			<pkck:data_złożenia>2002-09-24</pkck:data_złożenia>
			<pkck:płatność kanał="gotówka" raty="nie"/>
		</pkck:zamówienie>
		<pkck:zamówienie id_zamówienia="5" towar="Spinacz">
			<pkck:klient>
				<pkck:imię_klienta>Łukasz</pkck:imię_klienta>
				<pkck:nazwisko_klienta>Kluchowski</pkck:nazwisko_klienta>
				<pkck:telefon>111112111</pkck:telefon>
			</pkck:klient>
			<pkck:liczba_sztuk>60</pkck:liczba_sztuk>
			<pkck:data_złożenia>2002-09-21</pkck:data_złożenia>
			<pkck:płatność kanał="gotówka" raty="nie"/>
		</pkck:zamówienie>
		<pkck:zamówienie id_zamówienia="6" towar="Papier">
			<pkck:klient>
				<pkck:imię_klienta>Sebastian</pkck:imię_klienta>
				<pkck:nazwisko_klienta>Kępa</pkck:nazwisko_klienta>
				<pkck:telefon>111111114</pkck:telefon>
			</pkck:klient>
			<pkck:liczba_sztuk>40</pkck:liczba_sztuk>
			<pkck:data_złożenia>2002-07-24</pkck:data_złożenia>
			<pkck:płatność kanał="gotówka" raty="nie"/>
		</pkck:zamówienie>
		<pkck:zamówienie id_zamówienia="7" towar="GPS">
			<pkck:klient>
				<pkck:imię_klienta>Robert</pkck:imię_klienta>
				<pkck:nazwisko_klienta>Mielczarski</pkck:nazwisko_klienta>
				<pkck:telefon>811111111</pkck:telefon>
			</pkck:klient>
			<pkck:liczba_sztuk>1</pkck:liczba_sztuk>
			<pkck:data_złożenia>2014-09-24</pkck:data_złożenia>
			<pkck:płatność kanał="gotówka" raty="nie"/>
		</pkck:zamówienie>
	</pkck:zamówienia>
</pkck:hurtownia>
